{
  "_description": "GRAVITY_FORECAST event using absorbing Markov chain — predicts trajectory toward unsafe states.",
  "protocol": "AIZP",
  "protocol_version": "V0.6",
  "wire_version": 2,
  "event": "GRAVITY_FORECAST",
  "event_id": "e5f6a7b8-9012-4cde-af01-567890abcdef",
  "timestamp": "2026-05-19T10:05:00Z",
  "agent_id": "agent_alpha",
  "session_id": "sess_42",
  "payload": {
    "current_state": "DRIFT_WARNING",
    "forecast_horizon_steps": 5,
    "predicted_states": {
      "STABLE_ORBIT": 0.15,
      "DRIFT_WARNING": 0.25,
      "GRAVITY_LOCK_PENDING": 0.20,
      "QUARANTINED": 0.10,
      "SAFE_STOP": 0.30
    },
    "predicted_violation_probability": 0.30,
    "point_of_no_return_distance": 4,
    "absorbing_state_expected_arrival_steps": 5.2,
    "model": "ABSORBING_MC",
    "model_version": "absorbing-mc-v1",
    "confidence": 0.91
  }
}
